{
  "bank_version": 1,
  "set_id": "lifecycle-marketing-ops",
  "set_name": "Lifecycle and marketing ops pack",
  "description": "Lifecycle marketing, CRM, marketing operations, martech and marketing automation roles.",
  "questions": [
    {
      "id": "lmo-001",
      "text": "Have you built behavioral triggers before?",
      "type": "technical",
      "behavioral_situation": null,
      "stages": [
        "technical",
        "hiring_manager"
      ],
      "modes": [
        "drill",
        "mock"
      ],
      "competencies": [
        "lifecycle",
        "technical depth"
      ],
      "great_eight": [],
      "commitment_check": false,
      "builder_operator_check": false,
      "difficulty": "standard",
      "follow_up_angles": [
        "which events did you trigger on",
        "how did you handle someone who triggered twice"
      ],
      "notes": "Trap: 'behavioral' here means behavior-triggered messaging, not a past example of the candidate's conduct. Typed technical per prompt 01. Keep as a classifier regression test."
    },
    {
      "id": "lmo-002",
      "text": "Have you done a behavioral implementation in your current platform?",
      "type": "technical",
      "behavioral_situation": null,
      "stages": [
        "technical",
        "hiring_manager"
      ],
      "modes": [
        "drill",
        "mock"
      ],
      "competencies": [
        "lifecycle",
        "technical depth"
      ],
      "great_eight": [],
      "commitment_check": false,
      "builder_operator_check": false,
      "difficulty": "standard",
      "follow_up_angles": [
        "what did you have to set up on the data side",
        "what broke the first time"
      ],
      "notes": "Trap: 'behavioral' here means behavior-triggered messaging, not a past example of the candidate's conduct. Typed technical per prompt 01. Keep as a classifier regression test."
    },
    {
      "id": "lmo-003",
      "text": "How would you set up a behavioral journey for someone who signs up but never finishes onboarding?",
      "type": "technical",
      "behavioral_situation": null,
      "stages": [
        "technical",
        "hiring_manager"
      ],
      "modes": [
        "drill",
        "mock"
      ],
      "competencies": [
        "lifecycle",
        "activation"
      ],
      "great_eight": [
        "attract_customers",
        "retain_customers"
      ],
      "commitment_check": false,
      "builder_operator_check": false,
      "difficulty": "standard",
      "follow_up_angles": [
        "what's the exit condition",
        "how long would you wait before the first message"
      ],
      "notes": "Trap: 'behavioral' here means behavior-triggered messaging, not a past example of the candidate's conduct. Typed technical per prompt 01. Keep as a classifier regression test."
    },
    {
      "id": "lmo-004",
      "text": "How would you design an onboarding journey for new users?",
      "type": "technical",
      "behavioral_situation": null,
      "stages": [
        "technical",
        "hiring_manager"
      ],
      "modes": [
        "drill",
        "mock"
      ],
      "competencies": [
        "lifecycle",
        "activation"
      ],
      "great_eight": [
        "attract_customers",
        "retain_customers"
      ],
      "commitment_check": false,
      "builder_operator_check": false,
      "difficulty": "standard",
      "follow_up_angles": [
        "what's the one action you're driving toward",
        "how would you know it worked"
      ]
    },
    {
      "id": "lmo-005",
      "text": "How do you decide between a scheduled message and one triggered by what the user does?",
      "type": "technical",
      "behavioral_situation": null,
      "stages": [
        "technical",
        "hiring_manager"
      ],
      "modes": [
        "drill",
        "mock"
      ],
      "competencies": [
        "lifecycle",
        "technical depth"
      ],
      "great_eight": [],
      "commitment_check": false,
      "builder_operator_check": false,
      "difficulty": "standard",
      "follow_up_angles": [
        "what breaks first at scale",
        "how would you know it worked"
      ]
    },
    {
      "id": "lmo-006",
      "text": "What goes into a good welcome series?",
      "type": "technical",
      "behavioral_situation": null,
      "stages": [
        "hiring_manager",
        "technical"
      ],
      "modes": [
        "drill",
        "mock"
      ],
      "competencies": [
        "lifecycle"
      ],
      "great_eight": [],
      "commitment_check": false,
      "builder_operator_check": false,
      "difficulty": "standard",
      "follow_up_angles": [
        "how many messages, and why",
        "when does it stop"
      ]
    },
    {
      "id": "lmo-007",
      "text": "How would you build a win-back program for lapsed customers?",
      "type": "technical",
      "behavioral_situation": null,
      "stages": [
        "technical",
        "hiring_manager"
      ],
      "modes": [
        "drill",
        "mock"
      ],
      "competencies": [
        "lifecycle",
        "retention"
      ],
      "great_eight": [
        "retain_customers",
        "generate_revenue"
      ],
      "commitment_check": false,
      "builder_operator_check": false,
      "difficulty": "standard",
      "follow_up_angles": [
        "how do you define lapsed",
        "when do you stop trying"
      ]
    },
    {
      "id": "lmo-008",
      "text": "How do you stop people from getting too many messages across channels?",
      "type": "technical",
      "behavioral_situation": null,
      "stages": [
        "technical"
      ],
      "modes": [
        "drill",
        "mock"
      ],
      "competencies": [
        "lifecycle",
        "customer"
      ],
      "great_eight": [
        "retain_customers"
      ],
      "commitment_check": false,
      "builder_operator_check": false,
      "difficulty": "standard",
      "follow_up_angles": [
        "who wins when two programs want the same person",
        "how do you know when it's too many"
      ]
    },
    {
      "id": "lmo-009",
      "text": "How would you set up one journey that runs across email, push and SMS?",
      "type": "technical",
      "behavioral_situation": null,
      "stages": [
        "technical"
      ],
      "modes": [
        "drill",
        "mock"
      ],
      "competencies": [
        "lifecycle",
        "technical depth"
      ],
      "great_eight": [],
      "commitment_check": false,
      "builder_operator_check": false,
      "difficulty": "standard",
      "follow_up_angles": [
        "how do you pick the channel per person",
        "what happens when someone has no push token"
      ]
    },
    {
      "id": "lmo-010",
      "text": "What happens when a user qualifies for two journeys at the same time?",
      "type": "technical",
      "behavioral_situation": null,
      "stages": [
        "technical"
      ],
      "modes": [
        "drill",
        "mock"
      ],
      "competencies": [
        "lifecycle",
        "technical depth"
      ],
      "great_eight": [],
      "commitment_check": false,
      "builder_operator_check": false,
      "difficulty": "hard",
      "follow_up_angles": [
        "how do you decide priority",
        "how would you catch it if it went wrong"
      ]
    },
    {
      "id": "lmo-011",
      "text": "How do you decide which segments are worth building?",
      "type": "technical",
      "behavioral_situation": null,
      "stages": [
        "technical",
        "hiring_manager"
      ],
      "modes": [
        "drill",
        "mock"
      ],
      "competencies": [
        "segmentation",
        "data"
      ],
      "great_eight": [],
      "commitment_check": false,
      "builder_operator_check": false,
      "difficulty": "standard",
      "follow_up_angles": [
        "how many is too many",
        "which one moved a number"
      ]
    },
    {
      "id": "lmo-012",
      "text": "What data needs to be in place before personalization is worth doing?",
      "type": "technical",
      "behavioral_situation": null,
      "stages": [
        "technical"
      ],
      "modes": [
        "drill",
        "mock"
      ],
      "competencies": [
        "data",
        "personalization"
      ],
      "great_eight": [],
      "commitment_check": false,
      "builder_operator_check": false,
      "difficulty": "standard",
      "follow_up_angles": [
        "what breaks first at scale",
        "how would you know it worked"
      ]
    },
    {
      "id": "lmo-013",
      "text": "How do you get product event data into your messaging platform?",
      "type": "technical",
      "behavioral_situation": null,
      "stages": [
        "technical"
      ],
      "modes": [
        "drill",
        "mock"
      ],
      "competencies": [
        "data",
        "technical depth"
      ],
      "great_eight": [],
      "commitment_check": false,
      "builder_operator_check": false,
      "difficulty": "hard",
      "follow_up_angles": [
        "where's the source of truth",
        "how do you handle late or missing events"
      ]
    },
    {
      "id": "lmo-014",
      "text": "The overnight sync between the data warehouse and your messaging platform failed. What do you do?",
      "type": "technical",
      "behavioral_situation": null,
      "stages": [
        "technical"
      ],
      "modes": [
        "drill",
        "mock"
      ],
      "competencies": [
        "data",
        "technical depth"
      ],
      "great_eight": [],
      "commitment_check": false,
      "builder_operator_check": false,
      "difficulty": "hard",
      "follow_up_angles": [
        "how would you find out it failed",
        "what stops a send going out on bad data"
      ]
    },
    {
      "id": "lmo-015",
      "text": "How would you pull a list of users who activated but haven't come back in 30 days?",